<?xml version='1.0' encoding='UTF-8'?>
<dataset xmlns:xsi="http://www.w3.org/2001/XMLSchema-instance" xsi:noNamespaceSchemaLocation="dbxsd/dataset.xsd">

    <user_detail id="1" first_name="FirstName1" last_name="LastName1" cellphone="1234567890"/>

    <user id="111" email="email1" password="password1" user_detail_id="1"/>
    <user id="222" email="email2" password="password2" user_detail_id="1"/>

    <user_role user_id="111" role_id="1" />

    <news user_id="111" id="1" news_text="Text1" publication_date="2015-09-01 16:37:00" topic="Topic1" />

    <tag id="1" tag_name="TagName1" />

    <news_tag news_id="1" tag_id="1" />

    <role id="1" role_name="user"/>
    <role id="2" role_name="moderator"/>
    <role id="3" role_name="admin"/>

</dataset>
